Date	Title	Description	Code 1	Code 2
2024-10-24T15:15:50Z	Queen Bey & The VP: Beyoncé To Appear With Kamala Harris In Texas Tomorrow	Beyoncé has long allowed Kamala Harris to use her ‘Freedom’ song as the Vice President’s campaign soundtrack, but now Queen Bey is hitting the stage in person as the close White House race goes into its final days. The 32-Grammy winning superstar with appear …		
2024-10-28T20:31:23Z	Kamala Harris' 'first priority' as president: To 'stop this pain' and 'injustice' from abortion bans	Just one week out from the elections, Vice President Kamala Harris is using her pro-choice platform to carry her over the finish line.		
2024-11-01T18:44:01Z	Meet Kamala Harris' Family, Including Her Husband & 2 Step-Children	Vice President Kamala Harris is going to be spending the next few days in the spotlight in the leadup to the 2024 election, where she hopes to beat Donald Trump and become the next president of the United States. The election will take place on Tuesday (Novem…		
2024-10-25T01:03:37Z	Mel Gibson Maligns Kamala Harris As Having “IQ Of A Fence Post”; ‘Mad Max’ Star Supporting Donald Trump In Tight Election, He Says	Just a few days ago, Andrew Garfield praised his Hacksaw Ridge director Mel Gibson for the “beautiful healing with himself” the Oscar winner has done over the year. Based on comments Gibson made today at LAX about the Vice President of the United States, the …		
2024-10-19T10:00:30Z	[Removed]	[Removed]		
2024-10-20T08:17:50Z	Alec Baldwin Returns to ‘SNL’ to Spoof Bret Baier, Kamala Harris Interview; Months After Judged Dismissed Involuntary Manslaughter Case	"Alec Baldwin, who won an Emmy for playing former President Donald Trump, didn’t reprise that role — he returned to ""Saturday Night Live"" to play Fox News’ Bret Baier in an opening skit that spoofed this week’s interview with Kamala Harris.
The post Alec Baldw…"		
2024-10-28T21:46:11Z	GloRilla Endorses Kamala Harris, Lists Four Reasons to Vote for the Democratic Candidate	The Memphis-born rapper previously visited the White House in March, snapping a selfie with the Vice President		
2024-10-15T20:46:44Z	Could Kamala Harris Beat Trump at His Own Podcast Game?	The candidates in election 2024 have courted the biggest podcasters, but neither have appeared on the big daddy of them all: Joe Rogan’s show. Now both are making noises about it.		
2024-10-21T20:18:35Z	Ripple Co-Founder Larsen Flooding Kamala Harris' Election Effort With XRP	Ripple co-founder and Executive Chairman Chris Larsen said he'd added another $10 million in the Ripple-tied token {{XRP}} in an effort to boost Vice President Kamala Harris as the Democrat faces off against former President Donald Trump in next month's elect…		
2024-10-15T15:38:28Z	ElectionLine’s View From Abroad: Spain’s Vanessa Jaklitsch On Kamala Harris Proving Doubters Wrong & Why Europe Hopes Democracy Will Prevail	Welcome to ElectionLine’s A View From Abroad series, in which we speak with media figures who are not from America but keep a close eye on its politics. Every few weeks, these smart observers provide a unique perspective on the fraught and unpredictable campa…		
2024-11-03T19:30:13Z	Lady Gaga, Katy Perry, Oprah Winfrey Set for Kamala Harris’ Election Eve Pennsylvania Rallies	Gaga, the Roots, Winfrey, Jazmine Sullivan and more will take stage in Philadelphia, while Perry and Andra Day will appear along vice president at Pittsburgh rally on Monday night		
2024-10-12T21:51:59Z	Trump Calls Kamala Harris ‘Retarded’ During a Donor Dinner: Report	Donald Trump called Democratic presidential Kamala Harris 'retarded' during a recent donor dinner, according to 'The New York Times.'		
2024-10-13T08:35:18Z	'SNL' Roasts 'Raised Middle-Class' Kamala Harris in 'Family Feud' Cold Open: 'The Whole World's Laughing at Her'	"Kenan Thompson, the longest-tenured ""Saturday Night Live"" cast member in the show’s history who began in 2003, reprised his long-running role as “Feud” host Steve Harvey and asked Maya Rudolph-as-Harris about her recent media blitz.
The post ‘SNL’ Roasts ‘Rai…"		
2024-10-22T10:00:24Z	[Removed]	[Removed]		
2024-10-13T09:48:12Z	[Removed]	[Removed]		
2024-11-01T01:37:09Z	Donald Trump sues CBS over ‘misleading’ interview with rival Kamala Harris	Lawsuit against 60 Minutes demands $10bn in damages and claims footage was edited.		
2024-10-25T18:01:40Z	Washington Post reports that owner Jeff Bezos stopped it from endorsing Kamala Harris	"Former Washington Post executive editor Marty Baron called the decision ""a moment of darkness that will leave democracy as a casualty."""		
2024-10-20T00:24:20Z	‘We Can’t Stand You, You’re a Sh*t Vice President!’ Rally Crowd Goes Wild as Trump Urges Them to Tell Kamala Harris ‘Get The Hell Out!’	"Former President Donald Trump blasted Kamala Harris at his Pennsylvania rally for being a ""shit vice president"" and told her to ""get the hell out!"" 
The post ‘We Can’t Stand You, You’re a Sh*t Vice President!’ Rally Crowd Goes Wild as Trump Urges Them to Tell…"		
2024-10-19T10:00:00Z	Kamala Harris' Fox News appearance is a lesson for Democrats	Kamala Harris' Fox News interview with Bret Baier is a lesson for Democrats — and for Donald Trump.   With weeks until Election Day, find voters where they are.		
2024-10-24T13:05:49Z	Woman Says She Used an Apple AirTag to Track Down Stolen Kamala Harris Sign	When her lawn signs kept disappearing, one Missouri woman turned to innovative measures.		
2024-10-27T04:00:00Z	Who Is The ‘Real’ Kamala Harris? Who Is The ‘Real’ Tim Walz?	The question brings up the commonsense idea that human beings can wear a mask (a “persona”) and pretend to be one person while actually being something or someone entirely different. It’s based on the age-old philosophical topic of ...		
2024-10-15T17:46:05Z	Rural Voters, Share Why You're Supporting Kamala Harris Or Donald Trump	Voters who live in a rural community, we want to hear from you!View Entire Post ›		
2024-10-18T15:15:22Z	Cori Bush on Palestinian liberation, Kamala Harris and the pro-Israel lobby	Marc Lamont Hill talks with the US congresswoman about the November elections and Palestinian liberation.		
2024-10-16T13:55:01Z	Kamala Harris Has More Billionaires Prominently Backing Her Than Trump—Tyler Perry, Bill Ackman Weigh In (Update)	The likes of Jeff Bezos and Bill Gates have shied away from offering endorsements like their ultrarich counterpart Elon Musk, but they have shared some thoughts about the two candidates.		
2024-10-21T18:57:56Z	Kamala Harris Says Donald Trump's Potty Mouth “Demeans The Office” of the President	The former president, never big on decorum, was especially vulgar at a recent campaign stop in Pennsylvania.		
2024-10-25T16:24:42Z	“Bulls—“: Charlamagne Tha God And Anderson Cooper Spar Over Network’s Coverage Of Donald Trump Vs. Kamala Harris	Charlamagne Tha God and Anderson Cooper used expletives at points as they engaged in a spirited debate over how CNN and other networks have covered Donald Trump versus Kamala Harris. On AC 360 on Thursday, Cooper made the point that when it comes to Trump, “i…		
2024-10-11T10:30:00Z	Why Not Taxing Tips Is The One Thing Donald Trump And Kamala Harris Agree On	There’s not a lot that Vice President Kamala Harris and former President Donald Trump agree on, but doing away with taxes on tips is one thing that they’re both promot...		
2024-11-01T08:11:21Z	As Kamala Harris makes final appeal to U.S. voters in Philly, her supporters hope it's a seismic moment	Kamala Harris is holding her final campaign rally in Philadelphia on Monday night. While Harris herself has downplayed the historic nature of her candidacy, on the evening before election day, her supporters told CBC News it feels like a significant moment.		
2024-10-27T21:22:31Z	The Obamas Campaign for Kamala Harris	Emily Witt on the Kamala Harris campaign’s efforts to bolster support among young Black men, with the help of Barack and Michelle Obama, ahead of the 2024 Presidential election		
2024-10-28T06:00:00Z	Kamala Harris now supports nationwide legalization of recreational marijuana use â a strategic move to gain more votes	Vice President Kamala Harris said she does not use marijuana-infused “gummies” to manage the stress of her presidential campaign against former President Donald Trump. During a town hall in Royal Oak, Michigan on Oct. 21, the vice president was asked about st…		
2024-11-03T04:25:00Z	‘SNL’ Cold Open: The Real Kamala Harris Gives Herself a Pep Talk	"""You can do something your opponent cannot do. You can open doors,"" the VP tells Maya Rudolph"		
2024-10-12T16:52:22Z	‘Wholly Unqualified’: Trump Campaign Responds To Kamala Harris Medical Report Release	Vice President and Democratic Presidential nominee Kamala Harris released her medical record Saturday.		
2024-10-23T10:00:15Z	What Kamala Harris Needs to Do to Win Over More Black Men	“You’re going to pick on Black men and blame us for everything. What did you deliver to Black men in the past four years?”		
2024-10-22T19:18:53Z	Kamala Harris Secures Coveted Violent J Endorsement	Election Day is two weeks away, and we all have the same question on our minds: Who is Violent J voting for? Lucky for us, Troy Iwata trekked to the Gathering Of The Juggalos in August and found out who the Insane Clown Posse member and his fans will be casti…		
2024-10-22T15:56:05Z	Feeling Anxious About The Election? Kamala Harris Has Advice	In Royal Oak, Michigan, Maria Shriver met with Liz Cheney and Kamala Harris and asked the Vice President how she's handling the anxiety surrounding the upcoming November election. The two joked about gummies, and then Harris explained that, like most of us, s…		
2024-11-03T17:29:29Z	Kamala Harris' new lead in top Iowa poll could bode well for her in some key swing states	A new Iowa poll shows Harris ahead of Trump by three points, a major shift in a state that has voted red in the past two presidential elections.		
2024-11-01T00:58:36Z	‘Couch Potato Voters’ Could Help Trump Defeat Kamala Harris: Top Pollster	"On ""Forbes Newsroom,"" HarrisX Founder and CEO Dritan Nesho discussed a new HarrisX/Forbes Poll showing a statistically tied race for the presidency between vice president Kamala Harris and former president Donald Trump."		
2024-10-22T22:41:59Z	Full transcript: Vice President Kamala Harris interviewed by NBC News' Hallie Jackson	Vice President Kamala Harris was interviewed Tuesday by NBC News' Hallie Jackson at the Naval Observatory in Washington, D.C.		
2024-10-24T00:12:36Z	CBS News Attorney Responds To Donald Trump Lawsuit Threat Over Kamala Harris’ ’60 Minutes’ Interview: “No Private Right Of Action Exists”	An attorney for CBS News responded to a legal threat from Donald Trump’s team, writing that there was “no legal basis” for a demand that the network turn over an unedited transcript of a 60 Minutes interview with Kamala Harris. Trump has called for CBS to los…		
2024-10-11T18:36:00Z	Why Kamala Harris needs more support among Hispanic men	Vice President Kamala Harris is in Arizona vying for support among Hispanic men as they remain a key voting group in battleground states. CBS News' Weijia Jiang has more on the 2024 election.		
2024-10-18T18:39:24Z	Donald Trump, Not at All Worried About Losing the Election, Demands Kamala Harris Be “Forced Off the Campaign”	With 18 days to go, he’s begging for Joe Biden to come back.		
2024-10-19T12:00:55Z	Kamala Harris Leading in Three Must-Win Rust Belt States: Poll	The two candidates were tied in Pennsylvania in a head-to-head race, while Harris was ahead by 1 point with third-party candidates included.		
2024-10-11T07:53:57Z	[Removed]	[Removed]		
2024-10-30T18:30:49Z	Is Kamala Harris 'Giving Up' On North Carolina? What We Know	"One of Donald Trump's top political strategists has claimed the Kamala Harris presidential campaign is ""giving up on North Carolina"" after it was reported they had canceled over $1,700,000 of reserved television advertising in the battleground state.
On Tuesd…"		
2024-10-14T20:21:29Z	Kamala Harris promises ‘opportunity’ for Black men amid waning support	With less than a month before the US presidential elections, Democrats fear declining support in important demographic.		
2024-10-26T02:28:13Z	Beyoncé Speaks on Her 3 Kids at Kamala Harris Rally in Houston	"Beyoncé is returning to her roots. 
The “Texas Hold ‘Em” singer recently stepped out for a surprise appearance at Vice President Kamala Harris’ rally in her hometown of Houston. 
""I'm not here as..."		
2024-11-03T00:18:44Z	Kamala Harris May Flip State Donald Trump Won Twice, New Poll Suggests	A new poll from the Des Moines Register found a surprising reversal of fortunes for Donald Trump in a state he handily won twice.		
2024-10-25T21:47:23Z	New Polls Show Kamala Harris' Chances of Winning Michigan	"The battle for Michigan remains extremely close between Vice President Kamala Harris and former President Donald Trump, although a handful of polls in recent weeks have shown positive signs for Democrats.
The Great Lakes State is among a handful of contests t…"		
2024-10-21T17:23:20Z	Fox News’ Bret Baier Defends Combative Kamala Harris Interview, Would “Love” to Have Her on Again	The network’s chief political anchor speaks to Vanity Fair about his sit-down with the Democratic nominee, which drew big ratings—and controversy—and provided fodder for SNL.		
2024-10-26T03:06:48Z	Beyoncé Introduces Kamala Harris at Houston Rally: Watch	The musician delivered her speech beside her former Destiny’s Child bandmate Kelly Rowland		
2024-10-27T10:22:05Z	Trump courts Muslim voters as Kamala Harris holds rival rally in Michigan	Donald Trump appealed to Muslim voters in the battleground state of Michigan as Michelle Obama endorsed Kamala Harris.		
2024-10-13T12:16:34Z	Poll: Latino Voters Abandoning Kamala Harris as Donald Trump Builds Support	"Vice President Kamala Harris is trailing the past three Democratic candidates for the White House among Latino voters as former President Donald Trump is building his support among the critical group, a survey released Sunday shows.
The post Poll: Latino Vote…"		
2024-11-03T04:25:20Z	Kamala Harris Makes Surprise Appearance on 'Saturday Night Live'	"Vice President Kamala Harris made an unexpected detour to New York City, joining NBC's Saturday Night Live for the long-running comedy sketch show's final episode before Election Day.
The surprise appearance, which came after Harris departed Charlotte, North …"		
2024-10-31T17:48:06Z	Final Poll Flips to Donald Trump in Four-Point Swing From Kamala Harris	"Donald Trump has overtaken Kamala Harris in the final DailyMail.com/J.L. Partners national poll before Election Day, with a three-point lead over the vice president.
The poll, released Thursday, showed Trump with 49 percent support among likely voters, while …"		
2024-10-16T23:02:52Z	Kamala Harris Spars With Fox News’ Bret Baier In Heated Interview: ‘Joe Biden Is Not On The Ballot’	Harris’ heated interview with Fox News covered topics like immigration and her record as vice president.		
2024-10-20T09:00:02Z	‘I Would Rather Be Kamala Harris Than I Would Donald Trump’	Jim Messina managed Barack Obama’s re-election campaign and is wired into the Kamala Harris effort against Donald Trump. He sees 2024 coming down to how women, especially white-working class women, vote in the first presidential election since Dobbs.		
2024-11-03T04:22:36Z	Kamala Harris makes surprise appearance on SNL... Developing...	"Kamala Harris makes surprise appearance on SNL... Developing...

 
 
 
 (Top headline, 1st story, link)

 

 

 
 Related stories:MELTDOWN: THE DON SEETHING; THREATENS TO 'KNOCK PEOPLE OUT'...
VIDEO...
'MY BEAUTIFUL WHITE SKIN'...
SIMULATES ORAL SEX ON…"		
2024-10-30T14:03:26Z	Black, Latino, Women Healthcare Leaders Sign Letters In Support Of Kamala Harris	"More than two dozen Black and Latino health tech leaders have endorsed Kamala Harris for president. Another group of over 500 women healthcare leaders has also come out in support of Harris.
The post Black, Latino, Women Healthcare Leaders Sign Letters In Sup…"		
2024-10-13T21:52:34Z	'We're Not Voting for Kamala': Black Male Voters Slam Obama's Shame Tactics for Not Supporting Harris	Black conservative men have responded to former President Barack Obama's claims that they do not support Vice President Kamala Harris's campaign due to sexism, slamming him for not accurately representing the black community and for trying to shame them into …		
2024-10-24T20:39:49Z	What the Justice Department could look like under a Kamala Harris presidency	Kamala Harris’s team is quietly considering potential nominees for attorney general to lead the Justice Department if she beats Donald Trump in the 2024 election.		
2024-10-24T19:31:54Z	CNN’s Kamala Harris Town Hall Drew At Least 3.2 Million Viewers, Early Numbers Show	CNN’s town hall with Kamala Harris drew at least 3.2 million viewers, giving the network a big bounce from its regular audience in the 9 p.m. time period. The viewership likely will rise when final numbers come in later this afternoon. That figure is still we…		
2024-10-16T15:17:06Z	Kamala Harris Agrees With Charlamagne That Trump's Vision for America Is “Fascism”	The former president’s plans would “destroy our democracy,” the veep said, calling Trump a “weak” man who cozies up to dictators like Vladimir Putin.		
2024-10-21T14:19:00Z	Let's compare Donald Trump and Kamala Harris on AI, crypto, and Big Tech	It’s not surprising that technology regulation is an important issue in the 2024 presidential campaign.Read more...		
2024-10-18T13:48:05Z	Kamala Harris’ Fox News Interview Is Most-Watched Of The ‘24 Campaign	The interview made headlines for Harris' choice to appear on Fox News—and for the often contentious back and forth between Harris and Bret Baier.		
2024-10-17T18:04:39Z	Mark Cuban will campaign for Kamala Harris in 3 key swing states	Billionaire Mark Cuban will appear on Kamala Harris' behalf in three swing states by the end of the week.		
2024-10-16T04:03:35Z	Michigan Firefighters Union Declines to Endorse Kamala Harris in Presidential Election	"The Michigan Professional Fire Fighters Union (MPFFU) declined to endorse Vice President Kamala Harris in the upcoming presidential election.
The post Michigan Firefighters Union Declines to Endorse Kamala Harris in Presidential Election appeared first on Bre…"		
2024-10-17T11:30:39Z	Donald Trump’s friendly Fox News town hall vs. Kamala Harris’ unfriendly Fox News interview	"Well, that went down about as you would expect. Donald Trump did a town hall on Fox News that looked like a campaign rally. Kamala Harris did an interview on […]
The post Donald Trump’s friendly Fox News town hall vs. Kamala Harris’ unfriendly Fox News interv…"		
2024-10-31T06:15:15Z	Arnold Schwarzenegger has endorsed Kamala Harris for president	Schwarzenegger served as the governor of California from 2003 to 2011. He said he is frustrated with both parties, and does not trust either, but felt compelled to speak out.		
2024-10-20T12:10:01Z	Kamala Harris publicly agrees with protestor accusing Israel of genocide: 'What he's talking about, it's real' (Jon Levine/New York Post)	"Jon Levine / New York Post:
Kamala Harris publicly agrees with protestor accusing Israel of genocide: 'What he's talking about, it's real'  —  Vice President Harris publicly agreed with a protestor this week who interrupted her to accuse Israel of committing …"		
2024-10-25T21:00:00Z	Beyoncé & Kamala Harris on stage together in Houston and it is “epic”	Vice President Kamala Harris brings out global superstar and Houston native Beyoncé to campaign with her as she makes a stop in the city with less than two weeks to go before Election Day.		
2024-10-14T16:55:26Z	"Busted: Kamala Harris Plagiarized ""At Least A Dozen Sections"" Of Book On Crime"	"Busted: Kamala Harris Plagiarized ""At Least A Dozen Sections"" Of Book On Crime
 
Kamala Harris' plagiarism apparently goes far beyond Trump and Biden's economic plans.
In a Monday thread on X by investigative journalist Christopher Rufo, we learn that famed A…"		
2024-10-29T00:30:05Z	TMZ TV Hot Takes: Kelly Rowland Upstages Beyoncé at Kamala Harris Rally	"Kamala Harris brought out the big guns for a big rally in Texas ... but it was Kelly Rowland, and not Beyoncé, who stole the show ... at least that's the takeaway from our ""TMZ on TV"" crew. Kelly introduced Beyoncé, who introduced Kamala in…"		
2024-10-25T18:00:00Z	How Alpha Kappa Alpha Shaped Kamala Harris	On the New Yorker Radio Hour, David Remnick speaks with Jazmine Hughes about Kamal Harris’s membership in Alpha Kappa Alpha, the nation’s oldest Black sorority.		
2024-11-01T12:30:00Z	Michael Bloomberg voted for Kamala Harris 'without hesitation' — and slammed Trump's 'ignorance'	Billionaire and major Democratic donor Michael Bloomberg said he voted for Vice President Kamala Harris “without hesitation,” accusing former President Donald Trump of making the U.S. look like a banana republic.Read more...		
2024-10-20T03:58:02Z	SNL Video: Alec Baldwin’s Bret Baier Grills Kamala Harris for Fox News	Saturday Night Live brought back a familiar face to poke fun at Kamala Harris’ contentious sit-down with Fox News. Alec Baldwin, who’s hosted SNL more than anyone else and played Donald Trump during the 2016 election season, returned to Studio 8H to play Fox …		
2024-10-13T17:14:05Z	Trump rallygoer cites Christian faith for why he won't back 'hoe' Kamala Harris	"A supporter of former President Donald Trump cited his Christian faith while wearing a T-shirt that discouraged voting for Vice President Kamala Harris, calling her a ""hoe"" (sic).Ahead of a Sunday rally in Arizona, RSBN host Mike Fortin spoke to the young man…"		
2024-10-30T02:44:56Z	Kamala Harris sharpens her campaign message in primetime Washington speech	"The News
Kamala Harris summed up her campaign pitch with the largest rally of the cycle — at the White House ellipsis, with the office she wants to take over glowing right behind her.
“My presidency will be different because the challenges we face are differe…"		
2024-10-25T12:09:10Z	[Removed]	[Removed]		
2024-11-03T13:39:25Z	Chappell Roan Debuts New Song & Kamala Harris Stops By On John Mulaney Led ‘SNL’	Mulaney has been a favorite host at Studio 8H and appeared with Chappell Roan and VP Kamala Harris.		
2024-10-28T22:00:04Z	Kamala Harris is fighting for us—it's time we stand up and fight for her	As a proud Black man, a gay man, and someone who has survived and spoken out against sexual violence, I want to talk to my community—Black men, Black gay men, and the LGBTQ+ family. We're not going back, so we need to rally behind Vice President Kamala Harris.		
2024-10-14T16:26:49Z	Kamala Harris to Back Crypto Reg Framework in Speech Today, Campaign Says	Vice President and Democratic nominee Kamala Harris will announce her support for a regulatory framework for crypto as part of a speech targeting Black Men, her campaign announced Monday morning.		
2024-10-11T16:38:00Z	Kamala Harris juggling campaign, VP duties amid Hurricane Milton response	Vice President Kamala Harris is working to secure votes campaign trail while also taking part in the Biden administration's response to Hurricane Milton. CBS News senior White House correspondent Weijia Jiang has more.		
2024-10-14T16:14:53Z	Kamala Harris To Sit Down With Fox News’ Bret Baier For First Formal Interview On Network	Kamala Harris will sit down with Fox News’ Bret Baier for her first formal sit-down interview with the network ever. The interview will be conducted in Pennsylvania and will air on Special Report with Bret Baier at 6 p.m. ET. Baier is the network’s chief poli…		
2024-10-21T20:08:41Z	Kamala Harris Isn’t Repeating the Mistakes of 2016	Donald Trump might still win, but it won’t be for Democrats’ lack of a well-organized campaign.		
2024-10-31T03:18:00Z	‘Grotesquerie’ Star Niecy Nash-Betts Unpacks Finale, Shares Hopes For Season 2 & Explains Why Lois Is “One And The Same” With VP Kamala Harris	SPOILER ALERT! This post contains details from the finale of FX’s Grotesquerie. It looks like Lois may never be making it to Florida after all. The finale of FX’s Grotesquerie felt, in some ways, like the 10 episodes came full circle, with Niecy Nash-Betts pu…		
2024-10-29T14:05:48Z	Kamala Harris On Führer Trump's MSG Rally: 'More Vivid Than Usual'	"Vice President Kamala Harris was asked to expound on her criticisms of Trump's hateful campaign rally at Madison Square Garden Sunday while at Joint Base Andrews in Maryland earlier Monday.
Harris explained that this horrific rally with its racism and hatred …"		
2024-11-02T10:00:00Z	Key Moments from the Donald Trump–Kamala Harris 2024 Presidential Election	Major milestones in the campaign also involving Joe Biden, J. D. Vance, Tim Walz, Robert F. Kennedy, Jr., debates, assassination attempts, and the party conventions.		
2024-10-31T15:17:08Z	Will Taylor Swift Appear at Kamala Harris' Pennsylvania Rally? What We Know	"Rumors are circulating on social media that Taylor Swift could appear at a rally that Vice President Kamala Harris is reportedly holding in Pennsylvania on the eve of Election Day.
Harris will be holding a rally in front of the iconic Philadelphia Museum of A…"		
2024-10-22T22:43:17Z	Kamala Harris Has More Billionaires Prominently Backing Her Than Trump—Microsoft’s Bill Gates, Steve Ballmer Weigh In (Update)	Bill Gates reportedly donated $50 million to a PAC backing Harris, a surprise move for the historically nonpartisan Microsoft cofounder.		
