Date	Title	Description	Code 1	Code 2
2024-10-29T23:57:05Z	Don Omar Endorses Kamala Harris, Calls Trump ‘Truly Worrying’	"""Trump has made it clear, time and again, what he thinks of us,"" the Puerto Rican artist writes, days after racist remarks about the country were made at a Trump rally in New York"		
2024-10-19T19:13:11Z	Video of Kamala Harris Asked 'Will You Marry Me?' Takes Internet by Storm	The vice president was making a campaign stop in Michigan when she got the question from an attendee at the rally.		
2024-11-01T11:20:27Z	Jennifer Lopez Endorses Kamala Harris for President, Blasts Trump	Kamala Harris trotted out another major celebrity endorsement on Thursday — and this time it was Jennifer Lopez, who blasted Donald Trump for throwing what many perceived as a racist rally at Madison Square Garden. The Democratic presidential…		
2024-10-25T16:33:39Z	JD Vance Demands Kamala Harris To 'Shut The Hell Up' About John Kellys Claims	"Vice Presidential nominee JD Vance threw a fit at General Mark Kelly's revelations regarding Trump's admiration for Hitler.
Then he weirdly demanded that Kamala Harris 'shut the hell up' about it. 
Methinks Hillbilly Vanilli is WAY too emotional to lead.
That…"		
2024-10-24T16:27:56Z	“We’re Distracted”: Kamala Harris Allies Fear She’s Letting Trump Dominate the Final Stretch	Supporters say the VP isn’t hammering Trump hard enough—and her media plays may be too little too late. The campaign is “more worried about her being a liberal,” one notes, “than they are by his behavior or by Project 2025.”		
2024-10-29T14:49:54Z	Here’s how much more Kamala Harris could earn if she wins the election	"Kamala Harris is not in for much of a surprise when it comes to pay if she gets elected come this November. That’s because the presidential salary has stayed the same since before the 21st century—last changing in 1999, under the Clinton administration.
Even …"		
2024-10-18T15:07:51Z	Kamala Harris Put Down A MAGA Heckler And It Was Glorious	"During a rally in La Crosse Wisconsin, VP Harris dispatched a heckler with a few simple words that were graceful, had dignity, and were very funny.
The Vice President was campaigning in a battleground state instead of going to the Al Smith dinner since she's …"		
2024-10-26T07:10:49Z	TMZ TV Hot Take: Mel Gibson Goes After Kamala Harris' IQ	"Mel Gibson has made it clear he's not voting for Kamala Harris come November 5 ... the actor took shots at the Vice President's IQ, comparing it to ""a fence post."" The Oscar winner doled out his unfiltered opinion about the Presidential hopeful…"		
2024-10-18T06:23:03Z	[Removed]	[Removed]		
2024-10-23T16:23:28Z	Kamala Harris Has More Billionaires Prominently Backing Her Than Trump—Warren Buffett, Bill Gates Weigh In (Update)	The historically apolitical centibillionaires Warren Buffett and Bill Gates are taking different paths this election cycle.		
2024-10-13T03:55:29Z	SNL Video: Kamala Harris and Donald Trump Battle It Out on Family Feud	Presidential contenders Kamala Harris and Donald Trump settled their differences in classic TV fashion on this week’s Saturday Night Live — by going head-to-head on Family Feud! Saturday’s cold open pitted Maya Rudolph’s Harris and James Austin Johnson’s Trum…		
2024-11-01T17:21:36Z	Kamala Harris, Donald Trump rallying in Wisconsin in final US election push	Rival presidential candidates remain locked in a tight race four days before election day.		
2024-10-28T17:46:04Z	As US politics goes totally off the rails, Kamala Harris says to hell with it, let's start a Fortnite map	2024 keeps giving.		
2024-10-17T15:27:43Z	Watch Kamala Harris’ First Interview on Fox News	Democratic presidential candidate Vice President Kamala Harris sat down for her first-ever formal interview with Fox News on Thursday. The interview conducted by Special Report anchor Bret Baier was pre-recorded but aired in its entirety during the 6 p.m. hou…		
2024-10-17T18:17:01Z	The Most Revealing Exchange of Kamala Harris’ Fox News Interview	Bret Baier’s attacks said a lot more about Trump than Harris.		
2024-10-22T17:52:57Z	Kamala Harris Has More Billionaires Prominently Backing Her Than Trump—Steve Ballmer, Jamie Dimon Weigh In (Update)	You won't find endorsements from tech centibillionaires like Steve Ballmer, Jeff Bezos or Bill Gates, but many of the nation's richest have weighed in on the election.		
2024-11-03T01:36:12Z	Cardi B Slams Elon Musk For Calling Her A “Puppet” For Kamala Harris: “Fix My Algorithm”	Grammy-winning rapper Cardi B hit back at Tesla CEO Elon Musk after he called her a “puppet” for the Kamala Harris campaign. In the social media dust-up — made on Musk’s own X platform — a right-wing account posted a clip of the “WAP” singer at a Milwaukee ra…		
2024-10-17T20:45:06Z	Kamala Harris Might Keep Lina Khan at the FTC, After All	If she wins in November, there are indicators that Harris will keep the controversial FTC head, a new report claims.		
2024-10-12T12:00:00Z	Kamala Harris Has More Billionaires Openly Backing Her Than Trump (But Many Are Staying Silent)	The likes of Jeff Bezos and Bill Gates have shied away from offering endorsements like their ultrarich counterpart Elon Musk, but they have shared some thoughts about the two candidates.		
2024-10-29T12:48:27Z	Editorial Writers at L.A. Times & WaPo Resign After Billionaire Owners Block Kamala Harris Endorsements	The Los Angeles Times and The Washington Post announced that they would not be endorsing anyone in the U.S. presidential election this year, breaking decades of precedent and overriding planned endorsements of Kamala Harris. The decisions were ordered by the …		
2024-10-24T15:13:02Z	Beyoncé to Appear at Kamala Harris Rally in Houston Tomorrow: Report	"Fans have long speculated whether the pop star would officially endorse the Democratic nominee.
Beyoncé to Appear at Kamala Harris Rally in Houston Tomorrow: Report
Jonah Krueger"		
2024-10-13T15:06:11Z	Kamala Harris’ Career Of Releasing Murderers And Drug Dealers Proves She Won’t Be ‘Tough On Crime’	Harris' disastrous policies as the San Francisco district attorney increased crime, freed murderers, and cost lives.		
2024-11-01T14:47:00Z	Kamala Harris focuses on reproductive rights at Nevada rally	As Vice President Kamala Harris' campaign comes down the home stretch, she's continuing to slam former President Trump on issues like abortion. CBS News correspondent Lilia Luciano has more.		
2024-10-31T22:32:27Z	This Baseball Cap Celebrates the Dodgers’ Win (and Maybe a Kamala Harris Win Too)	The 'KamaLA' hat combines the VP's name with the Dodgers logo, making for a great pickup whether you're cheering for the team, the presidential candidate, or both		
2024-10-29T17:05:00Z	Kamala Harris And Tim Walz Launch Their Own Fortnite Map	As of today, there are seven days left in the campaign for the U.S. Presidential election. Now, the Democratic ticket headlined by Vice President Kamala Harris and Minnesota Governor Tim Walz is courting the gamer vote by launching their own map on Fortnite.F…		
2024-10-13T18:13:36Z	Exclusive: Juanita Broaddrick Slams Kamala Harris for Enlisting ‘Prolific Sexual Abuser’ Bill Clinton to Boost Campaign	The Harris campaign’s decision to bring “degenerate” former President Bill Clinton back to the political stage is “absolutely unbelievable,” according to Clinton accuser Juanita Broaddrick, who called the 42nd president “the most prolific sexual abuser in his…		
2024-10-29T18:17:13Z	Kamala Harris: Trump's DNA Is All Over Project 2025	In a CBS interview with Norah O'Donnell, Kamala Harris reminds voters to Google Project 2025, Trump's playbook for his presidency that many journalists have forgotten to read. Traditional media outlets continue to fail American voters by letting Donald Trump …		
2024-10-18T17:21:04Z	Kamala Harris Campaigns for the Swiftie Vote With ‘Fearless’ Taylor Swift Snapchat Filter	The Democratic National Committee has also posted billboards in the Miami area, despite it not being a campaign battleground, ahead of the singer's three stadiums shows this weekend		
2024-10-18T11:58:00Z	Nearly 8M Viewers Watched Kamala Harris’ Fox News Interview	The gamble paid off for Vice President Kamala Harris. The Democratic presidential candidate's contentious Wednesday-evening interview on Fox News returned nice dividends from a ratings perspective. (TVNewser) Harris' combative interview on Fox News delivered …		
2024-10-30T15:01:22Z	Kamala Harris Has More Billionaires Prominently Backing Her Than Trump—Bezos And Griffin Weigh In (Updated)	"""Even though I have plenty of disagreements with their platform...I am voting for Kamala Harris and Tim Walz,"" Schwarzenegger, the former Republican governor of California, wrote Wednesday."		
2024-10-22T18:58:14Z	Bruce Springsteen, Eminem Will Appear At Kamala Harris Rallies In Swing States	Bruce Springsteen and Eminem both have made some pretty scathing remarks against Donald Trump. That’s good. Still, they’re both white guys from working-class backgrounds who became some of the best-selling artists of all time; both Democrats and Republicans l…		
2024-10-27T23:36:57Z	Michelle Obama’s ‘Little Angry’ Speech Shuts Down MI Kamala Harris Rally, Former First Lady Flames Donald Trump’s Trifling Track Record	Michelle Sets Michigan Crowd Ablaze With The Stakes Of The 2024 Election: ‘A Vote For Him Is A Vote Against Us!’ Michelle Obama came in for the kill in Kalamazoo with a speech that effortlessly ethered Donald Trump’s infinite “incompetence”: “When the America…		
2024-10-29T13:08:34Z	Joe Rogan Open To Kamala Harris Podcast Interview But Only If She Travels To Him	Joe Rogan has said he “really” hopes he can make a podcast interview with Democrat Presidential candidate Kamala Harris happen, but he wants to set the terms of engagement. In a message on social media, Rogan wrote that Harris had “not passed on doing the pod…		
2024-11-03T16:10:21Z	"Kamala Harris Bans Virtual Guns In Her Own ""Freedom Town"" Fortnite Game"	"Kamala Harris Bans Virtual Guns In Her Own ""Freedom Town"" Fortnite Game
 
In the digital era video games are the most consumed form of entertainment by far, and gamers who spent their formative years playing the first generation Nintendo, Sega and Playstation…"		
2024-10-20T23:17:48Z	‘I Do Mean It, Actually’: Trump Town Hall Crowd Loudly Boos As He Wishes Kamala Harris Happy Birthday	"Trump wished Kamala Harris a happy 60th birthday, but the crowd at his Pennsylvania town hall was not as into it and booed her name loudly.
The post ‘I Do Mean It, Actually’: Trump Town Hall Crowd Loudly Boos As He Wishes Kamala Harris Happy Birthday first ap…"		
2024-10-30T15:20:15Z	Kamala Harris Makes Her Closing Argument at the Ellipse	At a rally whose location evoked January 6th, Harris sounded the alarm about Trump’s authoritarian tendencies but refused to linger in the national shame spiral that has formed around him.		
2024-10-13T15:30:36Z	This Market Pro Says Kamala Harris' Unrealized Capital Gains Tax 'Makes No Sense' And Will 'Suck Money Out Of The Market'	Vice President Kamala Harris has endorsed a tax proposal that is lighting up debates everywhere. The 25% minimum tax on total income, including unrealized...		
2024-10-30T18:40:28Z	We Refuse To Go Back. We Endorse Kamala Harris For President.	We can't believe we even need to say this, BUT WE CLEARLY DO.View Entire Post ›		
2024-10-19T20:40:49Z	Reporter Grills Kamala Harris Over Israel-Hamas War: ‘Do You Think You Could Lose the Election Because of Gaza?’	"Vice President Kamala Harris was grilled by a reporter over the recent escalation in the Gaza war following the death of Hamas leader Yahya Sinwar.
The post Reporter Grills Kamala Harris Over Israel-Hamas War: ‘Do You Think You Could Lose the Election Because…"		
2024-11-03T19:07:00Z	Chloë Grace Moretz addresses her sexuality for the first time as she endorses Kamala Harris	"The actor, known for her roles in films such as ""Kick-Ass,"" said she supported legal protections for the LGBTQ+ community ""as a gay woman."""		
2024-10-27T17:01:29Z	Kamala Harris and Donald Trump offer worlds-apart contrasts on top issues in presidential race	This year's U.S. presidential election contrasts Kamala Harris's vision of expanded social and climate policies with Donald Trump's focus on deregulation, fossil fuels, and strong immigration controls, reflecting stark differences on issues like abortion, dem…		
2024-10-26T20:20:00Z	Fake Photo of Kamala Harris in Mcdonald's Uniform	The image turned up on social media amid a political kerfuffle over Vice President Kamala Harris' claim that she once worked at McDonald's.		
2024-10-22T17:00:00Z	Kamala Harris just made a surprise announcement & now everyone’s talking about Beyoncé	Kamala Harris' campaign made a surprise announcement this morning that has everyone talking.		
2024-10-25T22:27:09Z	Leonardo DiCaprio Endorses Kamala Harris, Says Donald Trump “Continues To Deny The Facts” Of Climate Change	Leonardo DiCaprio endorsed Kamala Harris in a video posted to Instagram today, saying that her rival Donald Trump “continues to deny” the facts and science behind climate change. DiCaprio opened the video by noting that the devastating hurricanes that struck …		
2024-10-18T10:00:19Z	Kamala Harris Has Finally Embraced Being a Cop	The label hurt her in 2019, when Democratic politicians were racing to the left. Today she wears it like a badge, writes legal columnist Elie Honig.		
2024-10-16T00:32:26Z	Food, Rent, Electricity Prices Soar Under Joe Biden and Kamala Harris	"Americans have been feeling the pain of rising costs of everyday necessities since President Joe Biden (D) and Vice President Kamala Harris (D) took office in January 2021.
The post Food, Rent, Electricity Prices Soar Under Joe Biden and Kamala Harris appeare…"		
2024-10-17T14:00:47Z	Campaign calculus: the customer is sometimes wrong: Voters won’t thank Kamala Harris for the state of the economy	"Voters won’t thank Kamala Harris for the state of the economy
Why voters are down on America’s remarkable economy
Politicians rarely tell voters they are wrong. For Democrats trying to sell America’s economic success, the temptation must be strong. As our spe…"		
2024-10-20T20:48:59Z	Donald Trump Does Time Working at a McDonald’s to Troll Kamala Harris | Video	"The GOP candidate brags he's now worked ""15 minutes more"" than the vice president
The post Donald Trump Does Time Working at a McDonald’s to Troll Kamala Harris | Video appeared first on TheWrap."		
2024-10-21T15:07:20Z	[Removed]	[Removed]		
2024-10-19T09:50:00Z	There Is a Very Wrong Lesson to Take From Kamala Harris’ Performance Among Black and Latino Voters	The Democratic Party should not give up what has been possibly its most durable asset since the civil rights era.		
2024-10-12T12:39:08Z	Legacy publications are endorsing Kamala Harris. But does it make a difference?	"The News
The Atlantic backed Democratic candidate Kamala Harris for the US presidency on Thursday, the magazine’s fifth endorsement in its 167-year history.
Harris’ devotion to public service, respect for democracy, and belief in the “freedom, equality, and d…"		
2024-10-27T17:56:04Z	Beyoncé urges Americans to support Kamala Harris	".@Beyonce endorses @KamalaHarris: ""I'm not here as a celebrity. I'm not here as a politician. I'm here as a mother. A mother who cares deeply about the world my children and all of our children live in. A world where we have the freedom to control our bodies.…"		
2024-10-16T21:22:43Z	Report: Kamala Harris Would Import 12.3 Million Migrants	"President Kamala Harris could import almost four million migrants in 2025 -- and 12.3 million migrants during her four years -- by continuing President Joe Biden's policies, according to a report by pro-migration advocates.
The post Report: Kamala Harris Woul…"		
2024-10-20T13:19:00Z	SNL Brought Back Alec Baldwin To Reunite With Maya Rudolph’s Kamala Harris, But He Played A New Role Instead Of Donald Trump	This is a new look for Baldwin.		
2024-10-24T22:10:29Z	Maria Bartiromo Worried Kamala Harris Won't Certify Electors	"Fox Business host Maria Bartiromo and much of the Republican party claimed VP Mike Pence had a duty and the right to refuse to certify the election on January 6, but he refused to do so.
Any credible person understands the vice president doesn't have this aut…"		
2024-10-22T15:47:55Z	Eminem And Bruce Springsteen To Appear At Kamala Harris Rallies As Campaign Ramps Up Final Push	Kamala Harris’ campaign is lining up a series of music giants to appear or perform at campaign events in the final weeks before election day. Eminem will introduce Barack Obama at an event in Detroit this evening, according to CNN. Bruce Springsteen will perf…		
2024-10-16T10:07:14Z	Opinion: As a mom, I know what's best for my family. That’s why I’m voting Kamala Harris.	I want stability, safety, practical policymaking and a president my kids can look up to.		
2024-11-03T00:08:42Z	Kamala Harris Expected to Appear on ‘SNL’ in Bid for White House	Who needs Maya Rudolph when you can show off the real thing? U.S. Vice President and Democratic presidential candidate Kamala Harris is expected to appear on “Saturday Night Live,” according to a person familiar with the matter, the latest Oval Office hopeful…		
2024-10-13T22:26:47Z	Kamala Harris Word Salad: 'What We See Is So Hard to See That We Lose Faith or a Vision of Those Things'	"Vice President Kamala Harris was roasted for a word salad during a church service in North Carolina where she attempted to speak about having faith ""in times of crisis.""
The post Kamala Harris Word Salad: ‘What We See Is So Hard to See That We Lose Faith or a…"		
2024-11-01T04:36:20Z	Jennifer Lopez, At Kamala Harris Rally, Says Donald Trump’s Madison Square Garden Event Offended “Humanity And Anyone Of Decent Character”	Jennifer Lopez made a passionate case for Kamala Harris at a Las Vegas rally tonight, while chiding Donald Trump for bringing a parade of speakers to a Madison Square Garden event earlier this week who made racist jokes and sexist remarks. Trump “has consiste…		
2024-10-12T16:11:26Z	What We Learned From Kamala Harris’ Medical Report—and Why It’s Significant	"Harris' physician said she “remains in excellent health."""		
2024-10-11T15:53:25Z	Kamala Harris Experiencing Gender Divide Among Hispanic Voters: Poll	"Vice President Kamala Harris is experiencing a gender divide among Hispanic voters, according to a new poll from The Associated Press and the NORC Center for Public Affairs Research.
In less than a month, Harris, the Democratic presidential nominee, will face…"		
2024-10-22T16:54:41Z	Eminem to Introduce Barack Obama at Kamala Harris Rally in Detroit Tonight	The rapper will join the campaign trail at a get-out-the-vote rally in his Michigan hometown		
2024-10-28T13:05:00Z	Kamala Harris on top priorities if elected, campaign rhetoric and final push to Election Day	"""CBS Evening News"" anchor and managing editor Norah O'Donnell traveled on the campaign trail in Houston and Michigan with Vice President Kamala Harris. She spoke with the Democratic presidential nominee about what her first 100 days in office would look like …"		
2024-10-16T21:24:15Z	Kamala Harris Campaign Spokesman Says Her Fox News Appearance Is Crucial ‘Piece of the Puzzle’	In a new interview on Vanity Fair's ‘Inside the Hive’ podcast, Ian Sams tells host Brian Stelter that it signals Harris is “strong,” while Trump is “weak and withdrawn”		
2024-11-02T17:54:58Z	Jennifer Lawrence Campaigns for Kamala Harris in Las Vegas!	Jennifer Lawrence is hitting the campaign trails to support Kamala Harris! The 34-year-old Oscar-winning actress, who is currently pregnant with her second child, spent Friday (November 1) in Las Vegas, Nevada where she knocked on doors and met with local off…		
2024-10-17T10:09:56Z	Bret Baier Says Kamala Harris Caught Him Off Guard With Fox News Interview	"Fox News host Bret Baier was caught off guard by Kamala Harris and said she may have been ""icing the kicker"" by appearing later than scheduled for her interview with the network on Wednesday.
Baier also questioned whether Harris went into the interview seekin…"		
2024-10-23T20:43:05Z	Kamala Harris Asks Americans: Are You Really Going to Elect a Guy Who Has Good Things to Say About Hitler?	You'd think this would be an easy answer, and yet...		
2024-10-11T14:44:42Z	Democrats are melting down because men don't like Kamala Harris. Their solution: Accuse them of misogyny.	Democrats are panicking over recent indications that American men don't particularly like Kamala Harris and are increasingly gravitating toward President Donald Trump. Rather than do some soul-searching or find a way to engage with this disaffected demographi…		
2024-10-20T16:18:52Z	Cher Endorses Presidential Ticket of Kamala Harris and Tim Walz	“She is fighting for all of us,” Cher said of vice-president and Democratic presidential candidate Kamala Harris.		
2024-10-28T10:49:42Z	Latin Superstar Bad Bunny Backs Kamala Harris for President	Bad Bunny threw his support behind Vice President Kamala Harris on Sunday by sharing a video of the Democratic presidential nominee shortly after a comedian at Donald Trump’s Madison Square Garden rally made crude jokes about Latinos and called Puerto Rico a …		
2024-11-03T00:19:00Z	VP Hits ‘SNL’: Kamala Harris To Appear With Maya Rudolph On Last Show Before Election	Saturday Night Live viewers are going to be seeing double tonight when it comes to the Vice President of the United States. Kamala Harris will be appearing on the NBC late night show on Saturday, Deadline can confirm from campaign sources. Making an unschedul…		
2024-10-12T21:57:00Z	Kamala Harris in 'excellent health' — medical report	The White House has released a report on Democratic presidential candidate Kamala Harris' health. Harris' campaign has urged her rival, former President Donald Trump, to do the same ahead of the November 5 election.		
2024-10-11T04:25:21Z	The Complete Howard Stern Interview with Kamala Harris	It’s hard to know where to start. This election comes down to whether or not we want to reward someone who tried to subvert our democracy four years ago. Whether we want to preserve the alliances that have kept the peace since World War II. Whether women want…		
2024-10-25T15:37:10Z	Borat & Ali G Return, Take on VP Kamala Harris, Donald Trump (VIDEO)	With only days to go until the U.S. decides between Vice-President Kamala Harris and ex-reality show host, multi-impeached ex-POTUS, and convicted felon Donald Trump, it seems like everyone and their mother (and their mother's mother) has had a chance to shar…		
2024-10-25T15:47:53Z	Bruce Springsteen Performs at Kamala Harris Rally in Georgia, Slams Donald Trump as 'American Tyrant'	Bruce Springsteen is showing his support for Kamala Harris! After officially endorsing the Vice President earlier this month, the 75-year-old rock legend joined Harris, 60, on the campaign trail as she hosted a rally on Thursday (October 24) held at James R. …		
2024-10-18T13:52:28Z	Kamala Harris Targets ‘Swiftie’ Vote As Taylor Swift’s Eras Tour Returns In Miami	The Democratic National Committee’s Swiftie vote campaign includes custom Snapchat filters and billboard advertisements.		
2024-10-22T20:39:20Z	The Onion: “The Donald Trump and Kamala Harris campaigns both debuted new...	The Onion: “The Donald Trump and Kamala Harris campaigns both debuted new commercials Tuesday that attempt to win support fo		
2024-10-27T22:08:53Z	Donald Trump’s Madison Square Garden Rally Opens With Speakers Ranting About “F—ing Illegals,” Puerto Rico A “Floating Pile Of Garbage” And Kamala Harris As The “Antichrist”	Donald Trump’s rally today at Madison Square Garden was marked by an opening lineup of speakers who joked about Puerto Rico being a “floating pile of garbage,” ranted about “f—ing illegals” and declared that Kamala Harris was the “antichrist.” The extreme rhe…		
2024-10-24T16:58:59Z	Kamala Harris Goes There: Trump Is a “Fascist”	The VP’s frank description of the former president follows stark warnings from retired generals John Kelly and Mark Milley about Trump’s autocratic ambitions.		
2024-10-14T22:13:22Z	Omarosa Manigault Newman, Former Trump Staffer, Endorses Kamala Harris for President	Omarosa Manigault Newman is throwing her support behind Vice President Kamala Harris. The former director of communications for the Office of Public Liaison under Donald Trump, as well as a staffer in the Bill Clinton administration, spoke out in an interview…		
2024-10-19T23:28:26Z	Kamala Harris targets a rural Maine congressional district in her hunt for every possible electoral vote	In a presidential contest that’s expected to be tight, every electoral vote could matter. That's why the Harris campaign has cast its eyes northward to Maine, home to one of the largest, coldest and most rural congressional districts in the country.		
2024-10-31T14:59:38Z	College Trump Voter Is Sad: Everyone On Campus Is Voting For Kamala Harris	"Kamala Harris has a 31 point lead over Donald Trump in the youth vote of ages 18 to 29, and that translates when we see a college Trump supporter complaining to RSBN that her fellow students are all for Kamala Harris and the Democratic party in Green Bay WI.
…"		
