Date	Title	Description	Code 1	Code 2
2024-10-14T15:28:19Z	‘Something very wrong’ with Kamala Harris – Trump	The Republican candidate has called on his Democratic rival to pass a “cognitive stamina and agility” test Read Full Article at RT.com		
2024-10-31T21:13:34Z	Trump sues CBS over Kamala Harris interview	"Republican presidential candidate Donald Trump sued CBS on Thursday over an interview of his Democratic rival Kamala Harris aired in early October that the lawsuit alleged was ""doctored"" and misleading, according to a court filing.
The filing was made in the …"		
2024-10-17T20:22:10Z	[Removed]	[Removed]		
2024-10-26T12:57:19Z	Kamala Harris Tears Into Trump For Calling The U.S. A 'Garbage Can'	"On Friday in Houston, Texas, Vice President Kamala Harris tore into Donald Trump's description of the United States, claiming this country is ""like a garbage can for the world."" We've never seen a former president who loathes this country as Trump does before…"		
2024-10-20T08:03:00Z	5 cartoon critiques of the Kamala Harris media blitz	Artists take on 60 surrealist minutes, word salad, and more		
2024-10-19T00:39:56Z	Trump Slams Kamala Harris Over Claims He's 'Exhausted': 'She Didn't' Come to Al Smith Dinner	"Former President Donald Trump responded to claims that he was ""exhausted"" and canceling events, pointing out that Vice President Kamala Harris ""didn't"" attend the Al Smith dinner on Thursday night.
The post Trump Slams Kamala Harris Over Claims He’s ‘Exhauste…"		
2024-11-02T21:48:21Z	Exclusive -- Doug Burgum: 'No One Believes' Kamala Harris 'Changed' Views on Fracking	"North Dakota Governor Doug Burgum (R) spoke to Breitbart News Saturday about how ""no one believes that"" Vice President Kamala Harris has ""changed her position"" on fracking.
The post Exclusive — Doug Burgum: ‘No One Believes’ Kamala Harris ‘Changed’ Views on F…"		
2024-10-14T14:54:32Z	What To Know About Kamala Harris’ Economic Agenda As She Announces New Proposals For Black Men	The vice president rolled out new economic proposals aimed at Black men as she courts their vote.		
2024-10-23T04:00:00Z	At Detroit Rally for Kamala Harris, Eminem Endorses and Obama Raps	Voter turnout in Detroit, a longtime Democratic stronghold, will be crucial in determining who wins Michigan, a crucial swing state, in November.		
2024-10-13T17:52:57Z	Donald Trump Calls Kamala Harris the R-Word at Dinner with Billionaire Donors: Report	The former president reportedly lashed out about donors not appreciating him at the dinner, according to 'The New York Times'		
2024-11-01T20:12:38Z	Carrie Mae Weems Kitchen Table Photos Star in Kamala Harris Ad	The iconic images from Weems’s 1990 series appear in a recent video advertisement airing in key battleground states.		
2024-10-15T00:00:00Z	Meghan McCain threatens to spill “tea” on Kamala Harris, but nobody is thirsty…	McCain had a hissy fit after Kamala Harris said nice things about her late father.		
2024-11-02T16:00:09Z	Exclusive -- JD Vance Closing Argument: 'Kamala Harris Broke It; Donald Trump Will Fix It'	"Vice President Kamala Harris broke it, and former President Donald Trump will fix it, Sen. JD Vance (R-OH) said during an appearance on Breitbart News Saturday, laying out the closing argument for the campaign just days ahead of the election.
The post Exclusi…"		
2024-10-14T15:00:11Z	[Removed]	[Removed]		
2024-11-03T01:12:45Z	Kamala Harris expected to appear on SNL, say U.S. media reports	U.S. Vice-President Kamala Harris has made an unannounced trip to New York to appear on Saturday Night Live, briefly stepping away from the battleground states where she's been campaigning with just three days to go before the election.		
2024-10-14T21:40:57Z	I'm a lifelong Wisconsin conservative. Here's why I just endorsed Kamala Harris.	I'm a Wisconsin Republicans. Here's why I'm voting for Kamala Harris over Donald Trump — and why Mike Pence and Mitt Romney could learn from Liz Cheney.		
2024-10-11T17:18:44Z	Donald Trump, Kamala Harris locked in close election race: WSJ poll	Wall Street Journal survey suggests Trump and Harris neck-to-neck in six key swing states before the November 5 vote.		
2024-10-16T23:05:24Z	Kamala Harris Attempts to Reach Black Male Voters: First VP to 'Grow Chili Peppers''	"Vice President Kamala Harris attempted to reach black male voters by revealing to them that she was the ""first vice president"" to ""grow chili peppers"" at the vice president's residence.
The post Kamala Harris Attempts to Reach Black Male Voters: First VP to ‘…"		
2024-10-30T16:43:23Z	Ray Dalio doesn't like the choice between Kamala Harris and Donald Trump	Bridgewater Associates founder Ray Dalio isn’t too thrilled about the prospect of either a Kamala Harris or (second) Donald Trump administration.Read more...		
2024-10-30T00:21:46Z	Kamala Harris Draws Sharp Contrast With Donald Trump In Closing Argument Speech: “We Are Not A Vessel For The Schemes Of Wannabe Dictators”	Kamala Harris drew a sharp contrast with Donald Trump as she made her closing argument with the backdrop of the White House, telling a massive crowd at the Ellipse that the election is a choice between a hopeful future and chaos and division. “These United St…		
2024-10-13T23:19:55Z	The Day Kamala Harris Was Interviewed By The King Of All Media	"Donald Trump tore into Howard Stern, whom he called a “beta male” on Wednesday after an interview the host conducted with Vice President Harris. Via The Hill:
“BETA MALE Howard Stern made a fool of himself on his low rated radio show when he ‘interviewed’ Lyi…"		
2024-10-30T11:07:01Z	The business leaders that Kamala Harris could recruit for her Cabinet	While Mark Cuban and Uber's Tony West may be out of contention, Harris has many powerful ties in the business world.		
2024-10-15T22:45:22Z	Donald Trump and Kamala Harris Keep Making Economically Illiterate Promises	Former President Donald Trump and Vice President Kamala Harris keep making new promises. Trump fans applauded when he said he'll eliminate taxes on tips.		
2024-11-02T04:44:40Z	Cardi B Speaks at Wisconsin Kamala Harris Rally, Gives Donald Trump New Nickname	Cardi B hit the stage at a rally in support of Kamala Harris at Wisconsin State Fair Park Exposition Center on Friday night (November 1) in West Allis, Wisc. The 32-year-old rapper showed her support at the campaign stop and spoke in support of the Vice Presi…		
2024-10-21T21:23:10Z	Overnight Cable News Ratings for Oct. 15-17: Kamala Harris Interview With Bret Baier Boosts Fox News	Tuesday, Oct. 15 Fox News' The Five won in total viewers at 5 p.m. ET (all times Eastern), while Gutfeld! led in the Adults 25-54 demo. CNN's The Source with Kaitlan Collins was the network's top show in the demo and the network's third most-watched program i…		
2024-10-31T19:47:10Z	Kamala Harris Would Be Least Popular Democrat to Win Election in 64 Years	The vice president has also the highest unfavorable view by an opposing party.		
2024-10-28T16:46:13Z	Kamala Harris Has More Billionaires Prominently Backing Her Than Trump—Bloomberg Reportedly Gives Another $50 Million To Help Harris (Updated)	Michael Bloomberg's reported commitment to Democrats is up to almost $100 million this cycle.		
2024-10-25T18:00:00Z	What Black male voters should consider about Kamala Harris	Vice President Kamala Harris' campaign presents a unique opportunity for Black male voters to finally be heard		
2024-10-25T07:32:17Z	[Removed]	[Removed]		
2024-10-18T20:10:10Z	Kamala Harris Suddenly Pauses Rally to Call for Medic to Help Supporter	"Vice President Kamala Harris stopped her first rally of the day in Michigan on Friday for a medical emergency.
The Democratic nominee was in Grand Rapids Friday afternoon, where she was addressing union voters in the automotive industry. But she had to pause …"		
2024-10-23T12:00:00Z	Bill Gates dropped a cool $50 million backing Kamala Harris	Bill Gates has quietly donated about $50 million to a group working to elect Vice President Kamala Harris in next month’s presidential election, according to a new report.Read more...		
2024-10-24T14:34:36Z	Beyoncé Will Appear At Kamala Harris Rally Tomorrow, Report Says	Beyoncé’s song “Freedom” has served as Vice President Kamala Harris’ campaign anthem since she announced her candidacy this summer.		
2024-10-13T06:00:00Z	Kamala Harris openly bragged about using the DoJ to fight against speech the government doesnât agree with	Social media censorship has been pretty rampant under the Biden administration, but it could get a lot worse if Kamala Harris takes office. In fact, she has been bragging about using the Department of Justice to counter so-called misinformation for several ye…		
2024-10-12T14:13:03Z	‘Frankly Sir—‘ Trump-Leaning Voter Gets Earful From Kamala Harris About Trump At Town Hall	"Vice President Kamala Harris went on a tirade against Trump when a Trump-leaning voter asked her to explain ""how you got this candidacy?""
The post ‘Frankly Sir—‘ Trump-Leaning Voter Gets Earful From Kamala Harris About Trump At Town Hall first appeared on Med…"		
2024-10-26T06:57:04Z	[Removed]	[Removed]		
2024-10-28T00:30:23Z	Bad Bunny Backs Kamala Harris, Shares Video Of Her Talking About Her Plans For Puerto Rico	Bad Bunny, the Puerto Rican recording artist, is supporting Kamala Harris in the 2024 presidential election, as he shared a video of her plans for the U.S. territory. Benito Antonio Martínez Ocasio’s endorsement came as Donald Trump held a rally at Madison Sq…		
2024-10-12T16:46:51Z	Allergies Defeated, Presidency Next? Kamala Harris’ Health Report is In	"MOSCOW (Sputnik) - US Vice President and Democratic presidential nominee Kamala Harris is in ""excellent"" health, her physician, Joshua Simmons, said in a medical summary published by the White House on Saturday, just weeks before the election."		
2024-10-23T21:25:51Z	[Removed]	[Removed]		
2024-11-03T14:10:02Z	Kamala Harris makes surprise appearance on Saturday Night Live	A Republican member of the media regulatory agency said the appearance broke rules around equal time for candidates.		
2024-10-22T14:22:51Z	Kamala Harris Gets Bad News From Georgia's Black Voters	Kamala Harris' support from Black voters in Georgia is substantially less than Joe Biden's in 2020, according to a new poll.		
2024-10-22T16:31:19Z	Bruce Springsteen to Play Kamala Harris Rallies in Atlanta and Philadelphia	"Springsteen endorsed Kamala Harris for president earlier this month.
Bruce Springsteen to Play Kamala Harris Rallies in Atlanta and Philadelphia
Paolo Ragusa"		
2024-10-13T03:56:59Z	‘Saturday Night Live’ Cold Open Pits Donald Trump Against Kamala Harris In A Game Of ‘Family Feud’	Saturday Night Live mocked Donald Trump’s refusal to do another debate and instead had him face off with Kamala Harris in Family Feud. With Kenan Thompson as emcee Steve Harvey, the cold open brought back the election season regulars: Maya Rudolph as Harris, …		
2024-10-14T18:47:02Z	This Week On The Campaign Trail: Kamala Harris And Donald Trump Do Separate Fox News Appearances	Each cycle, presidential campaigns grapple with the diffusion of the media audience, evident this year as Kamala Harris and Donald Trump try to reach undecided voters on traditional news outlets, podcasts and late night television. That will be the case in th…		
2024-11-01T21:27:24Z	New York’s Top Chef Wants to Invite Kamala Harris to Dinner	The famed New York chef and owner of Tatiana in Lincoln Center talks about his dream people to cook for and his dinner-party rules.		
2024-10-20T15:12:25Z	Biden Will Not Appear With Kamala Harris Before Election Day: REPORT	President Joe Biden reportedly has no plans to appear alongside Vice President Kamala Harris on the campaign trail before Election Day.		
2024-10-17T19:18:08Z	Fox News Interview With Kamala Harris Drew 7.1 Million Viewers, According To Early Nielsen Data	Kamala Harris’ sit down with Fox News’ Bret Baier drew an estimated 7.1 million viewers, according to early Nielsen data, easily beating cable news rivals. The interview also drew 882,000 in the 25-54 demo. The interview was Harris’ first appearance on Fox Ne…		
2024-10-18T07:14:41Z	Watch Molly Shannon Revive ‘SNL’ Character to Advise Kamala Harris	Molly Shannon's 'Saturday Night Live' character Mary Katherine Gallagher made an appearance in a video Kamala Harris recorded for the Al Smith Dinner.		
2024-10-19T00:13:11Z	The Collapse Of Kamala Harris	"The Collapse Of Kamala Harris
 
Authored by Josh Hammer via American Greatness,
On July 26, in the aftermath of the Democratic Party’s ruthless midsummer coup of their own democratically elected presidential nominee, this column predicted that the elevation o…"		
2024-11-02T15:02:27Z	Cardi B Delivers Speech on Women’s Rights, Healthcare, and More at Kamala Harris’ Milwaukee Rally	The “Bodak Yellow” rapper threw her full-throated support behind the vice president while rebuking her Republican opponent		
2024-10-30T03:19:16Z	[Removed]	[Removed]		
2024-10-26T02:18:37Z	Beyoncé has officially endorsed Kamala Harris. Will it matter?	Beyoncé wasn’t just on the playlist at Vice President Kamala Harris’s Houston rally on Friday, she was also a special guest. The question is just how much Beyoncé can help Harris. The rally in deep-red Texas comes as the vice president finds herself in a dead…		
2024-10-17T02:10:28Z	Kamala Harris spars with Bret Baier over immigration in Fox News interview	The Democratic presidential candidate defended track record and called for solutions to a 'broken immigration system'.		
2024-10-27T17:12:13Z	"Transcript: ""Face the Nation"" excerpt of Norah O'Donnell interview with Vice President Kamala Harris"	"""CBS Evening News"" anchor Norah O'Donnell interviewed Vice President Kamala Harris in Kalamazoo, Michigan."		
2024-10-24T17:16:03Z	[Removed]	[Removed]		
2024-10-23T20:17:01Z	Literal Billionaires Are Afraid to Publicly Endorse Kamala Harris for Fear of Retribution by Donald Trump	You can’t really blame them, but you definitely can.		
2024-10-21T00:05:41Z	’60 Minutes’ Says Donald Trump Has Made False Claim That Its Kamala Harris Interview Was Deceitfully Edited	After Donald Trump’s continued attacks, 60 Minutes issued a statement today in which pushed back on the former president’s claim that its interview with Kamala Harris was deceitfully edited. Trump has continuously blasted the show and CBS, even calling for th…		
2024-10-11T08:00:00Z	Kamala Harris bet big on courting Republicans. Is her bet paying off?	Democratic nominee Kamala Harris bet big on the Nikki Haley voter, the chunk of Republicans who kept opposing Donald Trump in primaries — even when the primaries were over. It explains much of Harris's messaging, like boasts about owning a gun and being willi…		
2024-10-28T06:00:00Z	POLL: Donald Trump leads Kamala Harris among Hispanic male voters in Texas	A recent Mason-Dixon Polling & Strategy poll has revealed that former president Donald Trump leads Vice President Kamala Harris among Hispanic male voters in Texas. The poll, conducted from Oct. 14 to 17 among 625 registered Hispanic voters in Texas, reveals …		
2024-10-15T15:17:48Z	Trump Mocks Kamala Harris' Allergies While Refusing to Disclose Own Records	"President Donald Trump believes that Vice President Kamala Harris' allergies are ""deeply serious"" and ""clearly impact her functioning.""
Trump took to his social media platform, Truth Social, overnight to analyze his political opponent's medical records releas…"		
2024-10-19T19:42:05Z	Lizzo Vows ‘The Whole Country Will Be Like Detroit’ if Kamala Harris Becomes President	"The Detroit native made the comments a week after Trump made similar remarks from the city, although his statement was not intended to be endearing.
The post Lizzo Vows ‘The Whole Country Will Be Like Detroit’ if Kamala Harris Becomes President first appeared…"		
2024-10-23T01:10:09Z	Insane Clown Posse Endorse Kamala Harris	Insane Clown Posse’s Violent J has endorsed Kamala Harris for president, telling The Daily Show, “I want her to win because she’s a Democrat, and I love my mom.”		
2024-10-29T18:25:00Z	What will happen to Bitcoin if Donald Trump or Kamala Harris win the election? Here's what to know	Bitcoin is holding strong at $72,000, poised for a potential new all-time high just a week before the U.S. elections — an event that many traders anticipate will boost market optimism, irrespective of the outcome. Read more...		
2024-10-26T17:18:23Z	Beyoncé Fails to Deliver Odds Boost for Kamala Harris	"Vice President Kamala Harris' odds of winning the 2024 presidential election have worsened over the past 24 hours, according to a leading bookmaker.
On Friday, Betfair offered odds of 6/4 (40 percent) on Harris achieving victory on November 5, compared to 4/6…"		
2024-10-20T17:50:49Z	‘We’re Going to Subpoena Their Records!’ Trump Vows Investigation Into Editing of ’60 Minutes’ Interview With Kamala Harris	"Trump vowed an investigation into 60 Minutes' recent interview with Kamala Harris — in which one of her answers was edited in controversial manner.
The post ‘We’re Going to Subpoena Their Records!’ Trump Vows Investigation Into Editing of ’60 Minutes’ Intervi…"		
2024-10-16T17:45:37Z	Behar: Kamala Harris Would Be at 90% Without 'Misogyny'	"Wednesday on ABC's ""The View,"" co-host Joy Behar said Vice President Kamala Harris would be at 90% in the polls without all the ""misogyny out there.""
The post Behar: Kamala Harris Would Be at 90% Without ‘Misogyny’ appeared first on Breitbart."		
2024-11-01T07:00:00Z	Kamala Harris to Spend Election Night at Howard	"Kamala Harris to Spend Election Night at Howard

 


 
Liam Knox

Fri, 11/01/2024 - 03:00 AM


 
 Byline(s)
 
 Liam Knox
 
 
Kamala Harris to Spend Election Night at Howard

 


 
Liam Knox

Fri, 11/01/2024 - 03:00 AM


 
 Byline(s)
 
 Liam Knox"		
2024-10-13T17:55:04Z	REVEALED: Kamala Harris' Town Hall With 'Undecided Latino Voters' Was Rigged (Bonchie/RedState)	"Bonchie / RedState:
REVEALED: Kamala Harris' Town Hall With ‘Undecided Latino Voters’ Was Rigged  —  With her campaign stumbles continuing, Kamala Harris has been desperately attempting to shore up traditionally Democrat-friendly voting demographics.  On Thur…"		
2024-10-24T19:18:37Z	Beyoncé Expected to Perform “Freedom” at Kamala Harris Houston Rally Friday, Says Source	The Houston-born superstar is slated to take the stage alongside the candidate, sources confirm to VF.		
2024-10-12T12:29:05Z	Harris fans claw for victory with Kamala-themed nail polishes	"The race for the U.S. presidency is a nail-biter, so two Kamala Harris supporters have taken matters into their own manicured hands and launched a line of nail polishes themed around viral moments from the Democratic campaign.""We wanted something that was pla…"		
2024-11-03T17:00:00Z	‘Saturday Night Live’ Highlights: Vice President Kamala Harris Plays Opposite Vice President Kamala Harris	Taking a slight detour from swinging through swing states, the presidential hopeful joined the cast in Studio 8H for a cold open that allowed us to laugh and hope in spite of pre-Election Day anxiety and dread.		
2024-10-21T20:49:39Z	The Strangely Empty Politics of Kamala Harris	"""Harris seems to be adopting a gimmicky new strategy every day, from embracing cryptocurrency to announcing that as president she'll run all policy through a bipartisan council of advisors. She's throwing everything against the wall, hoping that something, an…"		
2024-10-11T17:07:36Z	Kamala Harris Gets Another Vogue Cover	Three weeks out from the election, Vice-President Kamala Harris got another ‘Vogue’ cover. This time, she’s not wearing Converse.		
2024-10-11T20:39:19Z	Why This Highly Accurate, Market-Based Election Indicator Seems To Be Predicting A Kamala Harris Win	This stock market predictor which has accurately coincided with 20 of the last four presidential election winners is a near lock to land in Harris’ favor—though betting odds are on Trump’s side.		
2024-10-28T14:24:26Z	Bad Bunny, Luis Fonsi, Ricky Martin, & Other Puerto Rican Pop Stars Endorse Kamala Harris Following Racist Jokes At Donald Trump Rally	Donald Trump held a rally at Madison Square Garden Sunday night, and some of the comments made there were maybe even more racist than usual. A self-proclaimed comedian named Tony Hinchcliffe started the rally with a brief set in which he told the crowd: “I do…		
2024-10-11T12:56:54Z	Obama says Black men should be supporting Kamala Harris over Trump	Former President Barack Obama spent Thursday on the campaign trail in Pennsylvania where he delivered a blunt message to Black men about why he believes they should be supporting Vice President Kamala Harris over former President Donald Trump. CBS News campai…		
2024-10-30T23:26:34Z	Jennifer Aniston Casts Vote For Kamala Harris: “Let’s Please End This Era Of Fear, Chaos & Attacks On Our Democracy”	Jennifer Aniston shared that she has cast her vote in the 2024 presidential election and supports Kamala Harris and Tim Walz. In a social media post, the Friends alum shared why she was backing the Democratic nominees. “Today not only did I vote for access to…		
2024-10-21T19:59:49Z	Ripple Co-Founder Larsen Flooding Kamala Harris' Election Effort With XRP	Ripple co-founder and Executive Chairman Chris Larsen said he'd added another $10 million in the Ripple-tied token {{XRP}} in an effort to boost Vice President Kamala Harris as the Democrat faces off against former President Donald Trump in next month's elect…		
2024-10-11T17:07:09Z	"CNN, VP Kamala Harris Set Town Hall; FOX ""News,"" Trump Set Infomercial"	In terms of debates? Yeah, those aren't happening anymore. Not after the ass-beating that Vice President Kamala Harris gave ex-reality show host, multi-impeached ex-POTUS, and convicted felon Donald Trump. Since that time, his campaign has been pulling out ev…		
2024-10-14T07:13:52Z	Kamala Harris Hits Trump With 1 Brutally Honest Question About His Health	"The vice president suggested Trump is ""too weak and unstable"" to lead the nation."		
2024-10-15T15:25:00Z	Kamala Harris participating in audio town hall hosted by Charlamagne tha God	"Vice President Kamala Harris will be in Detroit Tuesday to tape an audio town hall with Charlamagne tha God, co-host of ""The Breakfast Club."" CBS News campaign reporter Nidia Cavazos has more."		
2024-10-27T18:01:25Z	Kamala Harris Announces Madison Rally With Gracie Abrams & The National, Tim Walz Courts Midwest Emo Vote	Election Day is fast approaching, and Kamala Harris is quickly filling out her schedule leading up to Nov. 5. In the past few days alone, she’s hosted rallies featuring notable guest speakers and performers such as Barack Obama, Eminem, Bruce Springsteen, and…		
2024-10-11T14:00:00Z	270 Reasons: Because Kamala Harris Can Say the Word “Abortion”	Our friends at 270 Reasons are gathering a polyphonic orchestra of brilliant writers, teachers, doctors, filmmakers, artists, and citizens of all kinds to weigh in about their plans to vote this November. These opinion essays run the gamut from advocacy for b…		
2024-10-13T10:23:03Z	Donald Trump Holds a Rally in California, Kamala Harris’ Home State	With the presidency on the line in battlegrounds like Wisconsin and Pennsylvania, Trump spent Saturday night in solidly liberal California.		
2024-10-27T06:59:55Z	'Kamala Harris Will Get Us Into World War III,' Says Donald Trump	Trump reiterated that conflicts like the one following the October 7 attack by Hamas on Israel wouldn't have occurred if he were president.		
2024-10-14T16:40:08Z	"VP Kamala Harris Set for FOX ""News"" Interview This Wednesday"	While ex-reality show host, multi-impeached ex-POTUS, and convicted felon Donald Trump continues bunkering down and avoiding any press that isn't super friendly to him, Vice President Kamala Harris and her campaign have decided to feed into the allegations th…		
2024-10-20T03:36:55Z	Usher Joins Kamala Harris in Atlanta: Her Vision ‘Includes Everyone’	Usher spoke at a get out the vote event in Atlanta with Democratic presidential nominee and Vice President Kamala Harris on Saturday.		
2024-10-29T20:21:50Z	Jennifer Lopez To Join Kamala Harris At Las Vegas Campaign Rally; Maná To Perform	Jennifer Lopez will join Vice President Kamala Harris at a “When We Vote We Win” rally in Las Vegas on Thursday, October 31. Lopez, we’re told, will speak on the importance of voting, what’s at stake for the country with this election and why she is endorsing…		
2024-10-17T00:54:08Z	"VP Kamala Harris Interview: Does Bret Baier Actually Watch FOX ""News""?"	"Tonight was the night when Vice President Kamala Harris was kind enough to give FOX ""News"" a chance to feel like it should have a seat at the big kids' table in terms of news and journalism. When the dust settled, there were three key truths that can't be den…"		
2024-10-17T18:24:38Z	Jill Stein Hurts Donald Trump More Than Kamala Harris, Poll Suggests	"A new poll suggests that Green Party presidential candidate Jill Stein is drawing more voters from former President Donald Trump than from Vice President Kamala Harris.
According to a Noble Predictive Insights survey released last week, Harris holds a narrow …"		
2024-11-01T04:17:48Z	US election: Why is Kamala Harris losing Indian American voters?	She could become the Indian American president. So why is she bleeding votes - to Trump's advantage?		
